Date,User,Tweet,Tweet_no_http,Translated
2022-07-24 12:06:20+00:00,Microsoft202011,"連戦の疲れで休ませただけか、
怪我とか体調不調なのか、
⋯それともコロナか

 #カープ  #秋山翔吾","連戦の疲れで休ませただけか、
怪我とか体調不調なのか、
⋯それともコロナか

 #カープ  #秋山翔吾","Did you just let me rest from the fatigue of the series of battles?
Are you injured or unwell?
…or is it corona?

 #carp #shogo akiyama"
2022-07-24 12:06:20+00:00,itk_2323,"息子が初めて発熱😭😭
疲れが出たんか突発が来たんか
コロナもあるからわからんよな😭","息子が初めて発熱😭😭
疲れが出たんか突発が来たんか
コロナもあるからわからんよな😭","My son has a fever for the first time😭😭
Did you get tired or did you have a sudden outbreak?
I don't know because there is corona too 😭"
2022-07-24 12:02:57+00:00,Ri_li_official,"最近食欲ないしご飯まずくてしんどい
コロナとかじゃないけどストレス溜まってるとよくこうなる","最近食欲ないしご飯まずくてしんどい
コロナとかじゃないけどストレス溜まってるとよくこうなる","I don't have an appetite lately
It's not like corona, but when I'm stressed, this often happens"
2022-07-24 12:01:46+00:00,PyD06,"こうやって作物も、国土もどんどん盗まれていくお花畑日本。
これらの対策を一刻も早くしなければならないのに何もしない政治家。ニュースではしつこくにコロナ感染拡大したー！って煽るマスゴミ。
日本の今の状況に気づいている日本人はすごいストレスを感じていると思う。
私もイライラが凄い。","こうやって作物も、国土もどんどん盗まれていくお花畑日本。
これらの対策を一刻も早くしなければならないのに何もしない政治家。ニュースではしつこくにコロナ感染拡大したー！って煽るマスゴミ。
日本の今の状況に気づいている日本人はすごいストレスを感じていると思う。
私もイライラが凄い。","In this way, crops and land are being stolen more and more in flower garden Japan.
Politicians who do nothing even though they have to take these measures as soon as possible. The news has persistently expanded the corona infection! Mass garbage that agitates.
I think Japanese people who are aware of the current situation in Japan are feeling a lot of stress.
I'm so frustrated too."
2022-07-24 12:00:31+00:00,yuka_1201ol,Nスタで紹介されてダウンタウンの浜ちゃんもコロナ禍で使っていた一人カラオケの「ウタエット」ストレス発散や発声練習になるし、自宅で全力熱唱できるよ笑！ボイストレーニングのプロが開発したなら間違いないね。https://t.co/Mz3ULsomK9,Nスタで紹介されてダウンタウンの浜ちゃんもコロナ禍で使っていた一人カラオケの「ウタエット」ストレス発散や発声練習になるし、自宅で全力熱唱できるよ笑！ボイストレーニングのプロが開発したなら間違いないね。 ,"The one-person karaoke ""Utaet"" that was introduced on Nsta and used by Hama-chan in downtown during the corona crisis will relieve stress and practice vocalization, and you can sing with all your might at home lol! If it was developed by a voice training professional, there is no doubt."
2022-07-24 11:59:50+00:00,_sn__122,"モエカレ、ネタバレする前に早く観に行きたい(まだ行けてないオタク)

公開日の週にコロナ感染したのほんと、運がないなと思ってたけども、今となっては10日も休めてストレスフリーだった😂😂
仕事つらすぎ😇😇","モエカレ、ネタバレする前に早く観に行きたい(まだ行けてないオタク)

公開日の週にコロナ感染したのほんと、運がないなと思ってたけども、今となっては10日も休めてストレスフリーだった😂😂
仕事つらすぎ😇😇","Moekare, I want to go see it as soon as possible before I spoil it (otaku who haven't been there yet)

I thought I was really unlucky that I was infected with Corona the week of the release date, but now I have 10 days off and I'm stress-free 😂😂
Too much work 😇😇"
2022-07-24 11:58:30+00:00,kkanno_p,"最近のベイや野球については、采配よりコロナの方がよっぽどストレスよ

どうしょうもないけど","最近のベイや野球については、采配よりコロナの方がよっぽどストレスよ

どうしょうもないけど","As for the Bay and baseball these days, Corona is much more stressful than making decisions.

I can't help it"
2022-07-24 11:57:51+00:00,lapinlover1,"夫と美術館いって、帰ってきてから友達とビデオチャットして、夫とランニングして🏃

ストレスフリーで過ごせた週末。

引き続き、コロナから逃げきれますように。","夫と美術館いって、帰ってきてから友達とビデオチャットして、夫とランニングして🏃

ストレスフリーで過ごせた週末。

引き続き、コロナから逃げきれますように。","Go to an art museum with my husband, video chat with my friends after coming back, and run with my husband🏃

A stress-free weekend.

I hope you can continue to escape from Corona."
2022-07-24 11:57:34+00:00,ssyn_p,"前節に続きまたもや完敗…

９０分を通していろんな面での疲れを言い分けにしたくなるようなミスが多かったな…（実際コロナ拡大で移動や宿入り後でのストレスも大変だろうし","前節に続きまたもや完敗…

９０分を通していろんな面での疲れを言い分けにしたくなるようなミスが多かったな…（実際コロナ拡大で移動や宿入り後でのストレスも大変だろうし","Continuing from the previous section, another complete defeat...

Throughout the 90 minutes, there were many mistakes that made me want to explain my fatigue in various ways..."
2022-07-24 11:54:53+00:00,BufferGoomy,"あーあ。
こんなにストレス溜まってたら、当直してて発熱が来てシンプルにコロナだった時、そいつの病歴が明らかに遊び散らかして感染してたらその患者めちゃくちゃ冷たくあしらっちゃいそう。","あーあ。
こんなにストレス溜まってたら、当直してて発熱が来てシンプルにコロナだった時、そいつの病歴が明らかに遊び散らかして感染してたらその患者めちゃくちゃ冷たくあしらっちゃいそう。","Oh.
If I'm so stressed, when I'm on duty and have a fever and it's simply corona, if that patient's medical history is clearly messy and infected, I'm afraid that patient will be treated coldly."
2022-07-24 11:48:42+00:00,nanaoshino,"みんなからの匿名質問を募集中！

こんな質問に答えてるよ
● コロナ疲れの発散ほうほうは？
● 好きな方言とかありますか？
● 別のタグで配信してる人ってどう…
● 誕生日おめでとさん
#質問箱 #匿名質問募集中

https://t.co/FTmIdjXW8M","みんなからの匿名質問を募集中！

こんな質問に答えてるよ
● コロナ疲れの発散ほうほうは？
● 好きな方言とかありますか？
● 別のタグで配信してる人ってどう…
● 誕生日おめでとさん
#質問箱 #匿名質問募集中

 ","We are looking for anonymous questions from everyone!

I am answering this question
● How do you get rid of corona fatigue?
● Do you have a favorite dialect?
● What about people who distribute with different tags...
● happy birthday
# Question box # Looking for anonymous questions"
2022-07-24 11:48:27+00:00,sdYkb19NhnCh0tz,"7/24の題名は「帰りは疲れの塊」
アルパカからの🦙
つ、つかれた。
久々の祭りはコロナを忘れてる
良き

#題名のある毎日","7/24の題名は「帰りは疲れの塊」
アルパカからの🦙
つ、つかれた。
久々の祭りはコロナを忘れてる
良き

#題名のある毎日","The title of 7/24 is ""a mass of tiredness on the way home""
🦙 from alpaca
I got tired.
The festival after a long time forgets corona
good

# every day with a title"
2022-07-24 11:46:53+00:00,moka_kangeki,職場がコロナで大変なことになってて出勤した瞬間から気が狂いそうなんだけど、明日は朝から推しの配信があるからそれを楽しみに頑張る😢 出したくないけど勤務開始からずーっとアドレナリン出まくり。家帰った後にどっと疲れが出そう。 https://t.co/0CbiyHRDAh,職場がコロナで大変なことになってて出勤した瞬間から気が狂いそうなんだけど、明日は朝から推しの配信があるからそれを楽しみに頑張る😢 出したくないけど勤務開始からずーっとアドレナリン出まくり。家帰った後にどっと疲れが出そう。  ,"I feel like I'm going crazy from the moment I go to work because I'm having a hard time with corona at work, but tomorrow I'll have a recommended delivery from the morning, so I'll do my best to look forward to it 😢 I don't want to go out, but I've been on adrenaline since I started working. After I get home, I feel exhausted."
2022-07-24 11:46:18+00:00,ACExTR,"このご時世熱出てコロナじゃないって事があるの？？？？？？？
まぁ環境変わったし疲れかな、、、","このご時世熱出てコロナじゃないって事があるの？？？？？？？
まぁ環境変わったし疲れかな、、、","Is it possible that this fever is not corona? ? ? ? ? ? ?
Well, the environment has changed and I'm tired,,,"
2022-07-24 11:45:43+00:00,ecg_mt01,"んー。医療従事者憎しワクチン憎しと思われるTweetや報道、週刊誌は前から多数見ていましたが、コロナで溜まったストレスの対応は業務外です。。

#なんかみた","んー。医療従事者憎しワクチン憎しと思われるTweetや報道、週刊誌は前から多数見ていましたが、コロナで溜まったストレスの対応は業務外です。。

#なんかみた","Hmm. I've seen many tweets, reports, and weekly magazines that seem to hate medical workers and vaccines, but dealing with the stress that has accumulated due to COVID-19 is outside the scope of my work. .

#I saw something"
2022-07-24 11:42:39+00:00,ruri_yukikiimii,今年の受験はお試し受験で合格はできないと分かってるからこんなにやる気ないんだろうな…上司がコロナによる戦線離脱など泣きたくなる仕事面のストレスもあるけど…😇暴飲暴食して寝る日々を送ってるの良くないんだろうけど、今の案件が嫌すぎて勉強に集中できないという甘え🙃,今年の受験はお試し受験で合格はできないと分かってるからこんなにやる気ないんだろうな…上司がコロナによる戦線離脱など泣きたくなる仕事面のストレスもあるけど…😇暴飲暴食して寝る日々を送ってるの良くないんだろうけど、今の案件が嫌すぎて勉強に集中できないという甘え🙃,"I know I won't be able to pass this year's exam as a trial exam, so I guess I'm not motivated to do this...I have stress at work that makes me want to cry, such as my boss leaving the battlefield due to Corona...😇I spend my days eating and drinking and sleeping. I don't think it's good, but I hate the current project so much that I can't concentrate on my studies🙃"
2022-07-24 11:42:32+00:00,misaki_OW02,"おう…そろそろ本日は疲れが早々と出て来たみたいなので（そりゃそうか😅笑）早めの就寝します💦
また明日から1週間　コロナ対策も今以上に対策して頑張りましょうね🌟

それでは　おやすみなさい🤗 https://t.co/UsXyOgDD66","おう…そろそろ本日は疲れが早々と出て来たみたいなので（そりゃそうか😅笑）早めの就寝します💦
また明日から1週間　コロナ対策も今以上に対策して頑張りましょうね🌟

それでは　おやすみなさい🤗  ","Oh... it seems like I'm getting tired early today, so I'm going to bed early 💦
Another week from tomorrow Let's do our best to take measures against corona more than now 🌟

Good night then 🤗"
2022-07-24 11:40:38+00:00,mamu3jou,"4日間戦ったけど 今日は仕事休み。いつもより2時間も寝てしまったもんだから 頭痛がしていた。やっぱりコロナに負けたか…と思ったけど 抗原検査で陰性。疲れと肩こりからの頭痛だったのかも。夕方になって ケロッと治った。
ワクチン4回目接種最強説w 発熱全くなし！","4日間戦ったけど 今日は仕事休み。いつもより2時間も寝てしまったもんだから 頭痛がしていた。やっぱりコロナに負けたか…と思ったけど 抗原検査で陰性。疲れと肩こりからの頭痛だったのかも。夕方になって ケロッと治った。
ワクチン4回目接種最強説w 発熱全くなし！","I fought for 4 days, but today is my day off from work. She had a headache because she had slept two hours more than usual. I thought she lost to Corona after all, but the antigen test was negative. Maybe it was a headache from fatigue and stiff shoulders. In the evening she was completely cured.
The 4th vaccination is the strongest theory w No fever at all!"
2022-07-24 11:40:04+00:00,dortei_barat,ゼルダやらされてるんだけど下手すぎてストレスでコロナの症状悪化してると思う,ゼルダやらされてるんだけど下手すぎてストレスでコロナの症状悪化してると思う,"I'm being played Zelda, but I'm too bad at it, and I think the stress is exacerbating the symptoms of Corona."
2022-07-24 11:39:19+00:00,mame22sotsu,今日一日中コロナかもなって思ってたけど、遅番から早番で疲れとれてないだけだった。,今日一日中コロナかもなって思ってたけど、遅番から早番で疲れとれてないだけだった。,"I thought it might be corona all day today, but I was just not tired from the late shift to the early shift."
2022-07-24 11:35:21+00:00,WANNYAN09112022,"色々ストレスが重なり今月中頃から休職中の娘がいるのに旦那の妹と娘がお盆に帰省、我が家は旦那の元実家だから帰省中は泊まる。しかも最低4,5泊。コロナも増えてるからどうしようと義妹から電話。まあ車で来れば大丈夫と旦那。","色々ストレスが重なり今月中頃から休職中の娘がいるのに旦那の妹と娘がお盆に帰省、我が家は旦那の元実家だから帰省中は泊まる。しかも最低4,5泊。コロナも増えてるからどうしようと義妹から電話。まあ車で来れば大丈夫と旦那。","I have a daughter who has been on leave since the middle of this month due to various stresses, but my husband's sister and daughter return to my hometown for Obon. And minimum 4,5 nights. Corona is also increasing, so what to do, her sister-in-law called me. Well, if you come by car, you'll be fine, husband."
2022-07-24 11:33:28+00:00,Reviacy_D,"よく考えると、気を張ってるからエネルギー消費しておやつ食べてるわけじゃなくて、気を張ってるから何か食べてストレス解消してるんだな。会社で泣くわけにもいかんし(泣いたことあるけど)。
確かにコロナ前は徐々に体重増えてたしな。","よく考えると、気を張ってるからエネルギー消費しておやつ食べてるわけじゃなくて、気を張ってるから何か食べてストレス解消してるんだな。会社で泣くわけにもいかんし(泣いたことあるけど)。
確かにコロナ前は徐々に体重増えてたしな。","When I think about it, it's not that I'm trying to consume energy and eat snacks because I'm trying to be careful, but I'm trying to relieve my stress by eating something. I can't cry at work (although I've cried).
It's true that I was gaining weight gradually before Corona."
2022-07-24 11:32:02+00:00,kimidori0819,コロナが流行ってなければ普通に大会行ってたけど今行くのはちょっとくらいの体調続いててストレスマッハ,コロナが流行ってなければ普通に大会行ってたけど今行くのはちょっとくらいの体調続いててストレスマッハ,"If it wasn't for the corona epidemic, I would have gone to the tournament normally, but going now is a little stressful because my physical condition continues"
2022-07-24 11:30:31+00:00,sawachyandayo,"みんなからの匿名質問を募集中！

こんな質問に答えてるよ
● 雨の日は何をしてますか？
● 飲食や飲料に入っているストレス…
● 階段から大きいトトロが降りてき…
● コロナの時代になってから困った…
#質問箱 #匿名質問募集中

https://t.co/dPZ37SBYLZ","みんなからの匿名質問を募集中！

こんな質問に答えてるよ
● 雨の日は何をしてますか？
● 飲食や飲料に入っているストレス…
● 階段から大きいトトロが降りてき…
● コロナの時代になってから困った…
#質問箱 #匿名質問募集中

 ","We are looking for anonymous questions from everyone!

I am answering this question
● What do you do on rainy days?
● Stress in eating, drinking and drinking…
● Big Totoro comes down from the stairs...
● I've been in trouble since the corona era...
# Question box # Looking for anonymous questions"
2022-07-24 11:29:53+00:00,Tarere886,"謎の発熱と謎のロキソニンが効かない頭痛
ほぼ毎日外出はしてるからコロナの可能性もなくなないけど疲れかな？ https://t.co/OYpOYi0XP9","謎の発熱と謎のロキソニンが効かない頭痛
ほぼ毎日外出はしてるからコロナの可能性もなくなないけど疲れかな？  ","Mysterious fever and mysterious headache that loxonin does not work
I go out almost every day, so the possibility of corona doesn't go away, but maybe I'm tired?"
2022-07-24 11:28:22+00:00,v66_mittu_66v,"コロナ感染者増えているから明日から在宅になった。
会社のおじさんたち基本ノーマスクだしパーテーションもないし席も空きがなくて密だし地味にストレスだったんだよなぁ。","コロナ感染者増えているから明日から在宅になった。
会社のおじさんたち基本ノーマスクだしパーテーションもないし席も空きがなくて密だし地味にストレスだったんだよなぁ。","The number of corona infected people is increasing, so I will be at home from tomorrow.
The uncles at the company were basically no masks, no partitions, no seats, and it was crowded and stressful."
2022-07-24 11:27:32+00:00,pichimama_piyo,"一昨日の夜38.0だった娘、昨日一日様子見ててずっと平熱で過ごせたから今日は油断して外出(公園１時間含む😭)したんだけど、まさかの今また38.2😭😭😭

上がったり下がったりするパターンは聞いたことないからコロナではないと思いたい…😭😭😭

夜に上がるのって何…😭？
社会人のストレス熱みたい😭","一昨日の夜38.0だった娘、昨日一日様子見ててずっと平熱で過ごせたから今日は油断して外出(公園１時間含む😭)したんだけど、まさかの今また38.2😭😭😭

上がったり下がったりするパターンは聞いたことないからコロナではないと思いたい…😭😭😭

夜に上がるのって何…😭？
社会人のストレス熱みたい😭","My daughter who was 38.0 last night, I checked her all day yesterday and had a normal fever, so today I let my guard down and went out (including 1 hour at the park 😭), but now I'm 38.2 again 😭😭😭

I've never heard of a pattern that goes up and down, so I'd like to think it's not corona... 😭😭😭

What is going up at night... 😭?
It's like the stress fever of a member of society 😭"
2022-07-24 11:26:34+00:00,xxJIMIN_1013,"コロナコロナでとんでもないストレスがかかってもうどうにもならん。
オタ活が生き甲斐のわいにとっては、ほんとに制限されるのが嫌すぎる。。
ワクチン3回目も正直打ちたくないし、親に打て打て言われるし仕事ではストレスだし、たまらなく辛い。
何が正しいのか分からない誰が教えて","コロナコロナでとんでもないストレスがかかってもうどうにもならん。
オタ活が生き甲斐のわいにとっては、ほんとに制限されるのが嫌すぎる。。
ワクチン3回目も正直打ちたくないし、親に打て打て言われるし仕事ではストレスだし、たまらなく辛い。
何が正しいのか分からない誰が教えて","I can't help it anymore with a hell of stress in corona corona.
I really don't like being restricted because geek activities are my reason for living. .
Honestly, I don't want to vaccinate for the third time, and my parents tell me to hit it, and I'm stressed at work, and it's unbearably painful.
I don't know what's right, who can tell me"
2022-07-24 11:25:24+00:00,Tarako3725,"こんばんは( ‘-^ )-☆
日曜日いかがお過ごしでしたか？
平日の疲れは取る事が出来たでしょうか。
暑い日が続きますが人混みの中ではマスクを付ける、手指消毒、手洗いうがい等で新型コロナウィルス感染対策に取り組んでいきましょう！✨","こんばんは( ‘-^ )-☆
日曜日いかがお過ごしでしたか？
平日の疲れは取る事が出来たでしょうか。
暑い日が続きますが人混みの中ではマスクを付ける、手指消毒、手洗いうがい等で新型コロナウィルス感染対策に取り組んでいきましょう！✨","Good evening ( '-^ )-☆
How was your Sunday?
Were you able to get rid of the fatigue of the weekdays?
The hot days continue, but let's take measures against the new coronavirus infection by wearing a mask, disinfecting your hands, and gargling your hands when you're in a crowd! ✨"
2022-07-24 11:25:06+00:00,omohidedotjp,"三、四日前から足が痛いんだなぁ
周りに新型コロナウイルス陽性者が出ても、自分は自覚症状もないけど、足は痛い
平日はアルコールも断ってるのになぁ
関係なけりゃ、呑むけどなぁ
もしかするとストレスか？
#皮膚型結節性多発動脈炎 #発症は膝下 #プレドニン減量 #ステロイド #原因不明","三、四日前から足が痛いんだなぁ
周りに新型コロナウイルス陽性者が出ても、自分は自覚症状もないけど、足は痛い
平日はアルコールも断ってるのになぁ
関係なけりゃ、呑むけどなぁ
もしかするとストレスか？
#皮膚型結節性多発動脈炎 #発症は膝下 #プレドニン減量 #ステロイド #原因不明","I've had pain in my legs for three or four days.
Even if there are people who are positive for the new coronavirus around me, I have no subjective symptoms, but my feet hurt
I refuse to drink alcohol on weekdays.
If it doesn't matter, I'll drink
Maybe stress?
#cutaneous polyarteritis nodosa #onset below the knee #prednisone reduction #steroid #cause unknown"
2022-07-24 11:24:45+00:00,mairorichdays,"コロナのせいでなくなった
幼なじみの集まり早く集まりたい😭
ストレス発散したい https://t.co/Q79GK0tWNl","コロナのせいでなくなった
幼なじみの集まり早く集まりたい😭
ストレス発散したい  ","passed away due to corona
I want to get together with my childhood friends as soon as possible😭
I want to relieve stress"
2022-07-24 11:24:09+00:00,nicochan_nyao,"8月と9月にダンスのイベントがありまして、両方のリハーサルが始まってます✨
ダンス楽しいし、ストレス発散になるし、なによりお友達に会えるのが楽しくて毎日過ごしております^ - ^
お仕事も頑張ってるつもり！笑
コロナと熱中症には全力で気をつけてます🥲皆様も気をつけてくださいね！ https://t.co/7N0oQxLPO5","8月と9月にダンスのイベントがありまして、両方のリハーサルが始まってます✨
ダンス楽しいし、ストレス発散になるし、なによりお友達に会えるのが楽しくて毎日過ごしております^ - ^
お仕事も頑張ってるつもり！笑
コロナと熱中症には全力で気をつけてます🥲皆様も気をつけてくださいね！  ","We have dance events in August and September, and rehearsals for both have already started✨
Dancing is fun, it relieves stress, and most of all, I enjoy meeting my friends.
I'm going to do my best at work too! smile
I'm doing my best to be careful of corona and heat stroke 🥲 everyone please be careful too!"
