Date,User,Tweet,Tweet_no_http,Translated
2022-07-24 14:59:46+00:00,AtelierDragonJP,"おやすみはやっぱり、ナギさん置いて寝よう😊
これ描いたの、ほとんど１年前か。
コロナ禍ストレスMAXでお絵描き再開して、超久々にナギを描き始めた頃、夜中に描くことが多かったんで、やたらと「もう寝ろよ」って書いてるw
あのタイミングでナギを思い出したのも…辛い境遇でシンクロしたのかも😅 https://t.co/VlBJfP4eZb","おやすみはやっぱり、ナギさん置いて寝よう😊
これ描いたの、ほとんど１年前か。
コロナ禍ストレスMAXでお絵描き再開して、超久々にナギを描き始めた頃、夜中に描くことが多かったんで、やたらと「もう寝ろよ」って書いてるw
あのタイミングでナギを思い出したのも…辛い境遇でシンクロしたのかも😅  ","Good night, let's leave Nagi and go to sleep 😊
I drew this almost a year ago.
When I started drawing Nagi again for the first time in a long time, I often drew in the middle of the night, so I wrote a lot of ""Go to bed now"" w
It was at that moment that I remembered Nagi... Maybe it was a difficult situation to synchronize with 😅"
2022-07-24 14:56:29+00:00,DiscoTeiMeteo,"ココ最近、暑さとコロナと活動(推し活含む)疲れで体調崩してる人多い気がしてる！

地震や火山噴火、大雨関連などの自然災害も原因に入ってるかも？

休める時にちゃんと休んで、日常的に心から笑うタイミング作って、心身ともに健康でいられるる人が1人でも多いといいな…

(深夜の独り言)","ココ最近、暑さとコロナと活動(推し活含む)疲れで体調崩してる人多い気がしてる！

地震や火山噴火、大雨関連などの自然災害も原因に入ってるかも？

休める時にちゃんと休んで、日常的に心から笑うタイミング作って、心身ともに健康でいられるる人が1人でも多いといいな…

(深夜の独り言)","Coco Recently, I feel that there are many people who are out of shape due to the heat, corona and activity (including promotion) fatigue!

Natural disasters such as earthquakes, volcanic eruptions, and heavy rains may also be a factor.

I hope that there are as many people as possible who are able to rest properly when they can rest, create times to laugh heartily on a daily basis, and be healthy both physically and mentally...

(Late night soliloquy)"
2022-07-24 14:54:09+00:00,_hawks_ramu_,"選手の皆さん
前半戦お疲れ様でした。🙇🏻

AS明けのローテは
千賀大関和田？
柊太くんは8月から
火曜日に戻るかな？
8月の日程見たけどみっちり…😔
辛いのは金曜日が移動即試合ってこと😱
暑いし疲れが蓄積して
調整が大変だけど
怪我人コロナが出ませんように🙏 https://t.co/lDv7TQCYNK","選手の皆さん
前半戦お疲れ様でした。🙇🏻

AS明けのローテは
千賀大関和田？
柊太くんは8月から
火曜日に戻るかな？
8月の日程見たけどみっちり…😔
辛いのは金曜日が移動即試合ってこと😱
暑いし疲れが蓄積して
調整が大変だけど
怪我人コロナが出ませんように🙏  ","Players
Thank you for your hard work in the first half. 🙇🏻

Rote after AS
Senga Ozeki Wada?
Hiiragi-kun from August
Are you coming back on Tuesday?
I saw the schedule for August, but it's all right...😔
The hard part is that Friday is a moving match 😱
It's hot and I'm tired
Difficult to adjust
Don't let the injured corona come out 🙏"
2022-07-24 14:53:46+00:00,omochanobox,"濃厚接触者になって、明日までの
約1週間休みなんだけど、
結局コロナには感染してなかったみたいで家でぴんぴんしてたし、
やりたいこと好きな時間にできて
仕事にも行ってないから
めっっっちゃストレスフリー🙆‍♀️🌷","濃厚接触者になって、明日までの
約1週間休みなんだけど、
結局コロナには感染してなかったみたいで家でぴんぴんしてたし、
やりたいこと好きな時間にできて
仕事にも行ってないから
めっっっちゃストレスフリー🙆‍♀️🌷","Become a close contact person and wait until tomorrow
I have about a week off,
After all, I didn't seem to be infected with Corona, so I was fine at home,
I can do what I want when I want
I don't go to work
Very stress free 🙆‍♀️🌷"
2022-07-24 14:52:44+00:00,pochaminami,"コロナの感染者数が増え、濃厚接触者増え、自宅待機の人が増えた事により、職場の人数激減…やば疲れた…
そしてツキイチのあの日が来て撃沈…
週末は可能な限り寝た…
疲れが顔に出てたせいか旦那がケーキを買ってきてくれた☺️
イチバンボシ聴きながら食べてたら、やけに甘さが染み渡って泣いた https://t.co/eoro4T8mAi","コロナの感染者数が増え、濃厚接触者増え、自宅待機の人が増えた事により、職場の人数激減…やば疲れた…
そしてツキイチのあの日が来て撃沈…
週末は可能な限り寝た…
疲れが顔に出てたせいか旦那がケーキを買ってきてくれた☺️
イチバンボシ聴きながら食べてたら、やけに甘さが染み渡って泣いた  ","The number of people infected with Corona has increased, the number of close contacts has increased, and the number of people waiting at home has increased, resulting in a sharp decrease in the number of people at work... I'm so tired...
And then, that lucky day comes and sinks...
I slept as much as I could over the weekend...
My husband bought me a cake because I was tired ☺️
When I ate while listening to Ichibanboshi, the sweetness soaked through and I cried."
2022-07-24 14:52:03+00:00,PTshima_blog,"／ 
おはしま🏝 #おは戦400725jg🌙
＼
長男は、無事コロナでもなく疲れ果てて寝ております！どんなに熱があっても寝顔だけは天使👼
その辛さを本当に変わってやりたい！
それが出来たらどんなに幸せか！

元気は元気で困る時もあるけどね💦笑","／ 
おはしま🏝 #おは戦400725jg🌙
＼
長男は、無事コロナでもなく疲れ果てて寝ております！どんなに熱があっても寝顔だけは天使👼
その辛さを本当に変わってやりたい！
それが出来たらどんなに幸せか！

元気は元気で困る時もあるけどね💦笑","/
Good morning🏝 #Ohasen400725jg🌙
＼
My eldest son is sleeping exhausted, not corona safely! No matter how hot you are, only your sleeping face is an angel👼
I really want to change that spicy!
How happy I would be if I could do that!

I'm fine, but sometimes I'm in trouble 💦 lol"
2022-07-24 14:45:21+00:00,mizutamari_ni_,コロナをはじめとした感染症、戦争などをはじめとした社会情勢が深刻な中、生きてきた境遇で必死に耐えて、よくここまで生きてきた。不安や恐怖は決して減ることなく、この異常なストレス社会で生き抜いていたこと自体自分すごく頑張った。,コロナをはじめとした感染症、戦争などをはじめとした社会情勢が深刻な中、生きてきた境遇で必死に耐えて、よくここまで生きてきた。不安や恐怖は決して減ることなく、この異常なストレス社会で生き抜いていたこと自体自分すごく頑張った。,"In the midst of the seriousness of the social situation, including infectious diseases such as corona and war, I have lived so far, desperately enduring the circumstances in which I have lived. Anxiety and fear never diminished, and I worked really hard to survive in this abnormally stressful society."
2022-07-24 14:35:28+00:00,peach_roco,うー…扁桃腺がまた腫れかかってる気がするな…薬残ってたかな。本当に喉弱すぎて疲れが喉にくる(？)のどうにかならんかね。ｺﾛﾅ喉痛いというけど私通年で喉痛いから…,うー…扁桃腺がまた腫れかかってる気がするな…薬残ってたかな。本当に喉弱すぎて疲れが喉にくる(？)のどうにかならんかね。ｺﾛﾅ喉痛いというけど私通年で喉痛いから…,"Ugh...I feel like my tonsils are swollen again...I wonder if there's medicine left. My throat is really weak and tired (?) I wonder if I can manage it. It's called corona sore throat, but I have a sore throat all year round..."
2022-07-24 14:34:00+00:00,remonsummer,明後日、模擬試験だけど体調が今ひとつで夏バテのだるだる。この状態でやっても頭に入らないので疲れた時はぐっすり寝るか。マスクで肌荒れした部位が夏の汗でこじらせてしまってるし試験前のストレスなのかもう10年以上なかった口内炎ができるし免疫力ダダ下がってるけどコロナ感染の気配は皆無。,明後日、模擬試験だけど体調が今ひとつで夏バテのだるだる。この状態でやっても頭に入らないので疲れた時はぐっすり寝るか。マスクで肌荒れした部位が夏の汗でこじらせてしまってるし試験前のストレスなのかもう10年以上なかった口内炎ができるし免疫力ダダ下がってるけどコロナ感染の気配は皆無。,"The day after tomorrow, I have a mock exam, but I'm not feeling well and I'm exhausted from the summer heat. Even if I do it in this state, I can't get into my head, so when I'm tired, I'll sleep soundly. The areas where the mask has roughened my skin are aggravated by summer sweat, and I have a stomatitis that I haven't had in over 10 years, probably due to the stress before the exam, and my immunity is down, but there is no sign of corona infection."
2022-07-24 14:33:59+00:00,kantaknonta,"念のためPCR検査を受けたビビビ君は陰性。でも娘は鼻水ズビズビ。抗原検査は陰性だから登園可なんだけど、ホントに行ってもいいのか悩む。。

だぁぁぁ〜コロナが怖いとかよりも、この、休む休まないで悩まなきゃいけない事がストレスだな💨","念のためPCR検査を受けたビビビ君は陰性。でも娘は鼻水ズビズビ。抗原検査は陰性だから登園可なんだけど、ホントに行ってもいいのか悩む。。

だぁぁぁ〜コロナが怖いとかよりも、この、休む休まないで悩まなきゃいけない事がストレスだな💨","Bibi-kun, who received the PCR test just in case, is negative. But his daughter has a runny nose. The antigen test is negative, so I can go to kindergarten, but I'm wondering if I should really go. .

Aaaaa~ Rather than being afraid of Corona, I'm stressed that I have to worry about it without taking a break 💨"
2022-07-24 14:31:33+00:00,hear39,"和也遅くまで今日もがんばるね﹙´˙꒳​˙*﹚。いつも通りなら22時頃まで通常営業していたのかな？？お疲れ様𐀑 ꪾ*ﾟ
猛暑日だったけど疲れは大丈夫？？コロナ大流行してるからコツコツお休みしようね❁*。何とは言えないけど、ありがと⸜( * ॑꒳ ॑*)⸝⋆⸜(* ॑꒳ ॑* )⸝みてるね♩*ﾟ #Going #亀梨和也","和也遅くまで今日もがんばるね﹙´˙꒳​˙*﹚。いつも通りなら22時頃まで通常営業していたのかな？？お疲れ様𐀑 ꪾ*ﾟ
猛暑日だったけど疲れは大丈夫？？コロナ大流行してるからコツコツお休みしようね❁*。何とは言えないけど、ありがと⸜( * ॑꒳ ॑*)⸝⋆⸜(* ॑꒳ ॑* )⸝みてるね♩*ﾟ #Going #亀梨和也","Kazuya I'll do my best until late today ﹙´˙꒳​˙*﹚. I wonder if it was open as usual until around 22:00? ? Good job 𐀑 ꪾ*ﾟ
It was a hot day, but are you okay with getting tired? ? Corona is all the rage, so let's take a break ❁*. I can't say anything, but thank you⸜(* ॑꒳ ॑*)⸝⋆⸜(* ॑꒳ ॑*)⸝ I'm watching ♩*ﾟ #Going #Kazuya Kamenashi"
2022-07-24 14:30:38+00:00,mrji_MK,今日でスマートウォッチ（正確にはスマートバンド）買って一週間経って、風呂以外は寝てる時も含め常時装着してるが、心拍数とか歩数とか睡眠データとかストレス値とかをモニタリングしててホンマ面白い。医療用まで正確じゃなかろうが血中酸素濃度も測定できるしコロナ用と考えてもええ買い物やった。,今日でスマートウォッチ（正確にはスマートバンド）買って一週間経って、風呂以外は寝てる時も含め常時装着してるが、心拍数とか歩数とか睡眠データとかストレス値とかをモニタリングしててホンマ面白い。医療用まで正確じゃなかろうが血中酸素濃度も測定できるしコロナ用と考えてもええ買い物やった。,"It's been a week since I bought a smart watch (more precisely, a smart band) today, and I wear it all the time, including when I'm sleeping, except when I'm taking a bath. . It may not be accurate enough for medical use, but it can measure blood oxygen levels, and even if you think it's for corona, yes, I did shopping."
2022-07-24 14:27:49+00:00,koyomi1234567,コロナのせいでストレス溜まってゲームもLINEもしばらく封印すると決めた今日この頃,コロナのせいでストレス溜まってゲームもLINEもしばらく封印すると決めた今日この頃,"Around this time, I decided to shut down the game and LINE for a while due to the stress caused by the corona virus."
2022-07-24 14:27:25+00:00,cona_wind3751,"9時間掛りましたが、無事終了😊
桜島噴火したけど、少しでも地球の核のストレスが減少するといいな a 😉
悩みぬいて涙してきた１年間の苦悩にピリオドを打つ時が来ました。自分の人生だから自分んで決めなきゃ🙃
今週もコロナ感染と熱中症対策しながら頑張りましょう💞 https://t.co/nvRvWvVIPq","9時間掛りましたが、無事終了😊
桜島噴火したけど、少しでも地球の核のストレスが減少するといいな a 😉
悩みぬいて涙してきた１年間の苦悩にピリオドを打つ時が来ました。自分の人生だから自分んで決めなきゃ🙃
今週もコロナ感染と熱中症対策しながら頑張りましょう💞  ","It took 9 hours, but it ended successfully 😊
Sakurajima erupted, but I hope the nuclear stress of the earth will decrease a 😉
It's time to put an end to a year of pain and tears. It's your life so you have to decide for yourself🙃
Let's do our best while taking care of corona infection and heat stroke this week 💞"
2022-07-24 14:19:22+00:00,tJS8SRxChMrdJPV,コロナからの復帰11日目。疲れ易さはあるけど、復帰直ぐから夜勤もしてるし、なんとかやってる。食欲も徐々に普通、だけど食べると気持ち悪い。今日も夜勤。オムツのゴミをまとめたら、右肩やってしまった💦痛〜,コロナからの復帰11日目。疲れ易さはあるけど、復帰直ぐから夜勤もしてるし、なんとかやってる。食欲も徐々に普通、だけど食べると気持ち悪い。今日も夜勤。オムツのゴミをまとめたら、右肩やってしまった💦痛〜,"11th day back from corona. I get tired easily, but I've been working night shifts since I came back, and I'm doing it somehow. My appetite is gradually normal, but I feel sick when I eat. Night shift today. When I collected the garbage of the diaper, I hurt my right shoulder 💦 Ouch ~"
2022-07-24 14:14:42+00:00,kazuofujii0206,"9泊10日、生きて帰れた。
毎日、数十名の子供たちの前であの曲、この曲と沢山やった！途中、コロナでキャンセルになった学校の代わりに行く学校のスコアを前夜遅くまで見る日もあった。
で、疲れ果てて現在濃いウイスキー水割りでクールダウン。","9泊10日、生きて帰れた。
毎日、数十名の子供たちの前であの曲、この曲と沢山やった！途中、コロナでキャンセルになった学校の代わりに行く学校のスコアを前夜遅くまで見る日もあった。
で、疲れ果てて現在濃いウイスキー水割りでクールダウン。","I survived for 9 nights and 10 days.
Every day, in front of dozens of children, we played that song, this song, and so on! On the way, there were days when I watched the score of the school I went to instead of the school that was canceled due to Corona until late the night before.
So, I'm exhausted and cool down with a thick whiskey and water."
2022-07-24 14:14:37+00:00,halpas_D,"すまない。
夜勤と仕事環境の悪化（特に室温）で疲れが抜けず、しばらくTwitterを離れようと思っている。

チーム連絡等はDiscordでお願いします。

シフト作ってる部長がコロナでわからんので復帰予定は未定です。
ひとまず我輩、今週は休みます。","すまない。
夜勤と仕事環境の悪化（特に室温）で疲れが抜けず、しばらくTwitterを離れようと思っている。

チーム連絡等はDiscordでお願いします。

シフト作ってる部長がコロナでわからんので復帰予定は未定です。
ひとまず我輩、今週は休みます。","I'm sorry.
I'm tired from the night shift and the deterioration of the work environment (especially the room temperature), and I'm thinking of leaving Twitter for a while.

Please use Discord to contact the team.

I don't know the manager who is making the shift because of Corona, so I don't know when to return.
First of all, I'm taking a break this week."
2022-07-24 14:14:08+00:00,inaokichi,"「コロナは風邪みたいなもんだ」って人が多くなっているけど、やっぱり危険な感染症だと思うんだよな。
職場の同僚の家族も、ジョギング趣味の人だったのに、後遺症で疲れやすくなっちゃって、運動どころか仕事もきつくなっているって。
今、自分がそんな状況になったら、本当に困ったことになる。","「コロナは風邪みたいなもんだ」って人が多くなっているけど、やっぱり危険な感染症だと思うんだよな。
職場の同僚の家族も、ジョギング趣味の人だったのに、後遺症で疲れやすくなっちゃって、運動どころか仕事もきつくなっているって。
今、自分がそんな状況になったら、本当に困ったことになる。","More and more people are saying, ""Corona is like a cold,"" but I think it's still a dangerous infectious disease.
A family member of a colleague at work used to enjoy jogging, but due to the aftereffects of jogging, he got tired easily, and his work became even more difficult, not to mention exercising.
Now, if I were in that situation, I would be in real trouble."
2022-07-24 14:13:32+00:00,tomapokego,今久々出張から帰宅した嫁の第一声。『え　なんでおるん⁉︎部屋から出てくんなよ💢』　普通は大丈夫やった？とかちゃうの？こっちずっと1人で身の回りのことしててんから部屋にこもるとか不可能やろ。まじ1人の方がストレスフリーやった。コロナうつすぞ…くそ嫁が…呪 https://t.co/vuRtl9RVW8,今久々出張から帰宅した嫁の第一声。『え　なんでおるん⁉︎部屋から出てくんなよ💢』　普通は大丈夫やった？とかちゃうの？こっちずっと1人で身の回りのことしててんから部屋にこもるとか不可能やろ。まじ1人の方がストレスフリーやった。コロナうつすぞ…くそ嫁が…呪  ,"The first voice of my wife who came home from a business trip after a long absence. ``Why is she here!? Do you want to say? It's impossible for me to shut myself up in my room because I've been doing things all by myself. Seriously, one person was stress free. I'm going to get corona... my damn wife... curse"
2022-07-24 14:11:44+00:00,akane90212143,今日から25週！3年ぶりの実家で布団が合わなかったりするけど👶は今日も元気そうだしコロナのストレス少し減ったのも良かった！明日の夜は少し歩けるといいなぁ,今日から25週！3年ぶりの実家で布団が合わなかったりするけど👶は今日も元気そうだしコロナのストレス少し減ったのも良かった！明日の夜は少し歩けるといいなぁ,"25 weeks from today! It's been 3 years since my parents' house and the futon doesn't fit, but 👶 looks fine today, and it's good that the stress of corona has decreased a little! I hope I can walk a little tomorrow night"
2022-07-24 14:08:45+00:00,TamaiKikaku,この所、疲れが大変蓄積しているらしく、夜勤明けの夕方も、なかなかスッキリしない。遠出すれば、気分転換になり、疲労軽減になるだらうが、まだまだ遠出は無理でせう。疲れが、精神面にも影響が出て、面倒になることが多い。コロナ渦の副作用だ。どうすれば、良いのやら…。,この所、疲れが大変蓄積しているらしく、夜勤明けの夕方も、なかなかスッキリしない。遠出すれば、気分転換になり、疲労軽減になるだらうが、まだまだ遠出は無理でせう。疲れが、精神面にも影響が出て、面倒になることが多い。コロナ渦の副作用だ。どうすれば、良いのやら…。,"Lately, fatigue seems to be accumulating, and it's hard to feel refreshed in the evening after the night shift. If I go out, it will change my mood and reduce my fatigue, but I still can't go out. Tiredness affects the mental aspect, and it is often troublesome. It's a side effect of the corona vortex. How can I do better..."
2022-07-24 14:08:22+00:00,mamepippippi,因果関係はさだかではないけど、1ヶ月早産したのはストレスによるところが大きいと思うんですよね。産後もストレス与え続けてくれて、先述の「連絡は旦那に」の気まずいやりとりも頭から消え去り、当然のように病院に押しかけようとした。コロナで面会謝絶じゃなかったらと思うとゾッとする。,因果関係はさだかではないけど、1ヶ月早産したのはストレスによるところが大きいと思うんですよね。産後もストレス与え続けてくれて、先述の「連絡は旦那に」の気まずいやりとりも頭から消え去り、当然のように病院に押しかけようとした。コロナで面会謝絶じゃなかったらと思うとゾッとする。,"I'm not sure about the causal relationship, but I think stress was a big factor in giving birth one month prematurely. Even after giving birth, he continued to give me stress, and the awkward exchange of ""contact my husband"" disappeared from my mind, and I naturally tried to rush to the hospital. I'm horrified to think that I hadn't been banned from visiting due to Corona."
2022-07-24 14:07:40+00:00,oishikutaberuzo,コロナ禍で飲食のこと以外はほぼストレスを感じていない(しかもお取り寄せ等で発散)このタヌキ、確かに体重管理は得意💪,コロナ禍で飲食のこと以外はほぼストレスを感じていない(しかもお取り寄せ等で発散)このタヌキ、確かに体重管理は得意💪,This raccoon dog is really good at managing his weight 💪
2022-07-24 14:02:51+00:00,adjp_2357,コロナ禍はじまってからストレス解消のための飲食物増えたな,コロナ禍はじまってからストレス解消のための飲食物増えたな,"Since the start of the corona crisis, I've been eating more food to relieve stress"
2022-07-24 14:01:24+00:00,fubuki29645,"愚痴らしてください
マジで旦那無理😫
自宅待機期間ずーっとあーしろこーしろとマジでうるさい😡
あれどうする❓これどうする❓と自分で考えずめんどくさいことは委ねてくるし😡
この息苦しさはコロナの兆候なのかストレスなのか💦
火曜日から仕事復帰する予定なので後1日我慢😡
マジで限界です😡😡😡","愚痴らしてください
マジで旦那無理😫
自宅待機期間ずーっとあーしろこーしろとマジでうるさい😡
あれどうする❓これどうする❓と自分で考えずめんどくさいことは委ねてくるし😡
この息苦しさはコロナの兆候なのかストレスなのか💦
火曜日から仕事復帰する予定なので後1日我慢😡
マジで限界です😡😡😡","please complain
Seriously my husband can't do it😫
I'm really noisy all the time during my stay-at-home period 😡
I don't think about what to do about that and what to do about this and leave the troublesome things to you😡
Is this shortness of breath a sign of corona or stress 💦
I'm planning to return to work on Tuesday, so I'll be patient for the next day😡
It's really the limit 😡😡😡"
